date,title,summary,combined_text,source_url,link,positive,negative,neutral,net_sentiment
2026-02-23,Retirement delays of U.S. electric generating capacity may continue in 2026,"U.S. power plant owners and operators plan to retire nearly 11 gigawatts (GW) of utility-scale electric generating capacity from the U.S. power grid this year, according to data reported to us in our latest Preliminary Monthly Electric Generator Inventory. Almost all the scheduled retirements are either coal-fired power plants (58%) or steam turbines and simple-cycle natural gas (42%).","Retirement delays of U.S. electric generating capacity may continue in 2026. U.S. power plant owners and operators plan to retire nearly 11 gigawatts (GW) of utility-scale electric generating capacity from the U.S. power grid this year, according to data reported to us in our latest Preliminary Monthly Electric Generator Inventory. Almost all the scheduled retirements are either coal-fired power plants (58%) or steam turbines and simple-cycle natural gas (42%).",https://www.eia.gov/rss/todayinenergy.xml,https://www.eia.gov/todayinenergy/detail.php?id=67206,0.16383358153890198,0.19465192169888706,0.6415144967622108,-0.03081834015998508
2026-02-20,New U.S. electric generating capacity expected to reach a record high in 2026,"U.S. power plant developers and operators plan to add 86 gigawatts (GW) of new utility-scale electric generating capacity to the U.S. power grid in 2026 in our latest Preliminary Monthly Electric Generator Inventory report, a record if realized. Solar power makes up 51% of the planned 2026 capacity additions, followed by battery storage at 28% and wind at 14%.","New U.S. electric generating capacity expected to reach a record high in 2026. U.S. power plant developers and operators plan to add 86 gigawatts (GW) of new utility-scale electric generating capacity to the U.S. power grid in 2026 in our latest Preliminary Monthly Electric Generator Inventory report, a record if realized. Solar power makes up 51% of the planned 2026 capacity additions, followed by battery storage at 28% and wind at 14%.",https://www.eia.gov/rss/todayinenergy.xml,https://www.eia.gov/todayinenergy/detail.php?id=67205,0.18080114352778331,0.22771565779724928,0.5914831986749673,-0.04691451426946597
2026-02-19,Enhanced geothermal systems could expand geothermal power generation,"The first large-scale commercial enhanced geothermal system (EGS) power generator in the United States is under construction with the company reporting in our generator survey that it plans to bring the project online in June 2026. Below, we examine what enhanced geothermal systems are and how they differ from conventional geothermal systems.","Enhanced geothermal systems could expand geothermal power generation. The first large-scale commercial enhanced geothermal system (EGS) power generator in the United States is under construction with the company reporting in our generator survey that it plans to bring the project online in June 2026. Below, we examine what enhanced geothermal systems are and how they differ from conventional geothermal systems.",https://www.eia.gov/rss/todayinenergy.xml,https://www.eia.gov/todayinenergy/detail.php?id=67204,0.6085475554115202,0.14281444832238127,0.24863799626609856,0.4657331070891389
2026-02-13,U.S. natural gas production to reach record highs in 2026 and 2027,"We forecast that U.S. natural gas marketed production will increase by 2% to average 120.8 billion cubic feet per day (Bcf/d) in 2026 and then further increase to a record-high 122.3 Bcf/d in 2027 in our latest Short-Term Energy Outlook (STEO). Around 69% of forecast production over the next two years comes from the Appalachia, Haynesville, and Permian regions.","U.S. natural gas production to reach record highs in 2026 and 2027. We forecast that U.S. natural gas marketed production will increase by 2% to average 120.8 billion cubic feet per day (Bcf/d) in 2026 and then further increase to a record-high 122.3 Bcf/d in 2027 in our latest Short-Term Energy Outlook (STEO). Around 69% of forecast production over the next two years comes from the Appalachia, Haynesville, and Permian regions.",https://www.eia.gov/rss/todayinenergy.xml,https://www.eia.gov/todayinenergy/detail.php?id=67166,0.3961447736935061,0.12651191547931828,0.4773433108271756,0.2696328582141878
2026-02-11,EIA forecasts lower oil prices in 2026 and 2027 due to persistent stock builds,"We forecast that production of petroleum and other liquids will continue to exceed global demand, which results in Brent crude oil prices falling from an average of $69 per barrel (b) in 2025 to $58/b in 2026 and $53/b in 2027. Crude oil prices tend to decrease as global petroleum stocks increase. Persistently high implied global oil inventory builds in the near-term are putting downward pressure on crude oil prices despite heightened uncertainty around the volume of crude oil exports from Russia and Venezuela.","EIA forecasts lower oil prices in 2026 and 2027 due to persistent stock builds. We forecast that production of petroleum and other liquids will continue to exceed global demand, which results in Brent crude oil prices falling from an average of $69 per barrel (b) in 2025 to $58/b in 2026 and $53/b in 2027. Crude oil prices tend to decrease as global petroleum stocks increase. Persistently high implied global oil inventory builds in the near-term are putting downward pressure on crude oil prices despite heightened uncertainty around the volume of crude oil exports from Russia and Venezuela.",https://www.eia.gov/rss/todayinenergy.xml,https://www.eia.gov/todayinenergy/detail.php?id=67164,0.3135822576392907,0.6429363274694111,0.0434814148912982,-0.3293540698301204
2026-02-05,"Record natural gas stock withdrawals during week ending January 30, 2026","Working natural gas stocks fell 360 billion cubic feet (Bcf) in the Lower 48 states for the week ending January 30, 2026, amid Winter Storm Fern-the largest weekly net withdrawal reported in the history of the Weekly Natural Gas Storage Report. The withdrawal exceeded the five-year average for the same week by 89% (170 Bcf). The large withdrawals resulted from increased heating demand for natural gas and natural gas production curtailments because of severe winter weather. Working gas stocks are now 1.1% below the five-year average for this time of year.","Record natural gas stock withdrawals during week ending January 30, 2026. Working natural gas stocks fell 360 billion cubic feet (Bcf) in the Lower 48 states for the week ending January 30, 2026, amid Winter Storm Fern-the largest weekly net withdrawal reported in the history of the Weekly Natural Gas Storage Report. The withdrawal exceeded the five-year average for the same week by 89% (170 Bcf). The large withdrawals resulted from increased heating demand for natural gas and natural gas production curtailments because of severe winter weather. Working gas stocks are now 1.1% below the five-year average for this time of year.",https://www.eia.gov/rss/todayinenergy.xml,https://www.eia.gov/todayinenergy/detail.php?id=67124,0.6184283081972748,0.23242714836184808,0.14914454344087713,0.3860011598354267
2026-02-02,U.S. wholesale day-ahead electricity prices rose in 2025 with higher natural gas prices,"Average wholesale day-ahead electricity prices at most major trading hubs in the Lower 48 states were higher in 2025 than in 2024, driven largely by higher natural gas prices to electric generators. The largest increase in price was $29 per megawatthour (MWh) in New England's Independent System Operator (ISO-NE), and the largest decrease was $14/MWh in the upper Northwest's Mid-Columbia.","U.S. wholesale day-ahead electricity prices rose in 2025 with higher natural gas prices. Average wholesale day-ahead electricity prices at most major trading hubs in the Lower 48 states were higher in 2025 than in 2024, driven largely by higher natural gas prices to electric generators. The largest increase in price was $29 per megawatthour (MWh) in New England's Independent System Operator (ISO-NE), and the largest decrease was $14/MWh in the upper Northwest's Mid-Columbia.",https://www.eia.gov/rss/todayinenergy.xml,https://www.eia.gov/todayinenergy/detail.php?id=67106,0.2369109185584776,0.5563886985023305,0.2067003829391919,-0.31947777994385296
2026-01-30,New transmission line connecting Hydro-Quebec to ISO-NE begins commercial operations,"Over the past few years, Independent System Operator-New England (ISO-NE) has relied less on Canada for electricity. On January 16, 2026, the New England Clean Energy Connect (NECEC), a 1,200 megawatt (MW) transmission line project, began commercial operation. The new high-voltage direct current NECEC transmission line is primarily intended to increase the amount of hydroelectric power exported from Canada to New England. However, during Winter Storm Fern, New England exported more electricity to Canada than it imported.","New transmission line connecting Hydro-Quebec to ISO-NE begins commercial operations. Over the past few years, Independent System Operator-New England (ISO-NE) has relied less on Canada for electricity. On January 16, 2026, the New England Clean Energy Connect (NECEC), a 1,200 megawatt (MW) transmission line project, began commercial operation. The new high-voltage direct current NECEC transmission line is primarily intended to increase the amount of hydroelectric power exported from Canada to New England. However, during Winter Storm Fern, New England exported more electricity to Canada than it imported.",https://www.eia.gov/rss/todayinenergy.xml,https://www.eia.gov/todayinenergy/detail.php?id=67105,0.2307219950095427,0.29190672521809596,0.4773712797723613,-0.06118473020855325
2026-01-29,Petroleum electricity generation surpassed natural gas in New England during winter storm,"Although petroleum accounts for less than 1% of total U.S. utility-scale electric power generation, regions such as New England rely on oil-fired units during winter periods when cold weather creates high demand. When Winter Storm Fern affected New England this week, petroleum was the predominant energy source starting around midday on January 24 and lasting until early morning on January 26. Since then, petroleum and natural gas have been fluctuating as the primary energy source.","Petroleum electricity generation surpassed natural gas in New England during winter storm. Although petroleum accounts for less than 1% of total U.S. utility-scale electric power generation, regions such as New England rely on oil-fired units during winter periods when cold weather creates high demand. When Winter Storm Fern affected New England this week, petroleum was the predominant energy source starting around midday on January 24 and lasting until early morning on January 26. Since then, petroleum and natural gas have been fluctuating as the primary energy source.",https://www.eia.gov/rss/todayinenergy.xml,https://www.eia.gov/todayinenergy/detail.php?id=67104,0.8916186805092762,0.06936401844673296,0.03901730104399087,0.8222546620625433
2026-01-28,Coal-fired generation rose to meet demand during Winter Storm Fern,"In the week ending January 25, 2026, as Winter Storm Fern affected significant portions of the country, coal-fired electricity generation in the Lower 48 states increased 31% from the previous week. The increase contrasts with coal use in the earlier part of January, which had milder weather and consequently lower coal-fired generation compared with the same period in 2025.","Coal-fired generation rose to meet demand during Winter Storm Fern. In the week ending January 25, 2026, as Winter Storm Fern affected significant portions of the country, coal-fired electricity generation in the Lower 48 states increased 31% from the previous week. The increase contrasts with coal use in the earlier part of January, which had milder weather and consequently lower coal-fired generation compared with the same period in 2025.",https://www.eia.gov/rss/todayinenergy.xml,https://www.eia.gov/todayinenergy/detail.php?id=67084,0.545559795019717,0.31111624055226156,0.14332396442802148,0.2344435544674554
2026-01-27,Crude oil tanker rates reached multi-year highs in late 2025,"Shipping rates for crude oil tankers were at multi-year highs at the end of 2025 before falling in early 2026. Rates climbed in the fall of 2025 because of increased demand for crude oil shipments, particularly from buyers in East Asia, limiting the number of vessels available for bookings. In this analysis, we look at several key global tanker routes for Very Large Crude Carriers (VLCCs) and Suezmax tankers, including the Persian Gulf-to-Asia route and the U.S. Gulf Coast-to-Europe route.","Crude oil tanker rates reached multi-year highs in late 2025. Shipping rates for crude oil tankers were at multi-year highs at the end of 2025 before falling in early 2026. Rates climbed in the fall of 2025 because of increased demand for crude oil shipments, particularly from buyers in East Asia, limiting the number of vessels available for bookings. In this analysis, we look at several key global tanker routes for Very Large Crude Carriers (VLCCs) and Suezmax tankers, including the Persian Gulf-to-Asia route and the U.S. Gulf Coast-to-Europe route.",https://www.eia.gov/rss/todayinenergy.xml,https://www.eia.gov/todayinenergy/detail.php?id=67064,0.7742815361518477,0.17515750798052046,0.050560955867631846,0.5991240281713273
2026-01-26,Nuclear plants reported few outages in the first three weeks of January 2026,"Between January 1, 2026, and January 21, 2026, nuclear power plant outages averaged 2.0 gigawatts (GW), 20% less than in the same period in 2025 and below the previous five-year range (2021–25) for 7 out of 21 days.","Nuclear plants reported few outages in the first three weeks of January 2026. Between January 1, 2026, and January 21, 2026, nuclear power plant outages averaged 2.0 gigawatts (GW), 20% less than in the same period in 2025 and below the previous five-year range (2021–25) for 7 out of 21 days.",https://www.eia.gov/rss/todayinenergy.xml,https://www.eia.gov/todayinenergy/detail.php?id=67047,0.2832384575712835,0.02300822033299611,0.6937533220957204,0.2602302372382874
2026-01-23,"Severe winter weather across large portions of the country, natural gas prices increasing","Natural gas daily spot prices at the benchmark Henry Hub rose sharply over the past week, reaching nearly $8.15 per million British thermal units on January 22 as colder weather increased demand for space heating across the country. Higher wholesale natural gas prices generally contribute to higher wholesale electricity prices.","Severe winter weather across large portions of the country, natural gas prices increasing. Natural gas daily spot prices at the benchmark Henry Hub rose sharply over the past week, reaching nearly $8.15 per million British thermal units on January 22 as colder weather increased demand for space heating across the country. Higher wholesale natural gas prices generally contribute to higher wholesale electricity prices.",https://www.eia.gov/rss/todayinenergy.xml,https://www.eia.gov/todayinenergy/detail.php?id=67046,0.35236243844726556,0.17339904804489722,0.4742385135078372,0.17896339040236833
2026-01-22,EIA forecasts near-term U.S. crude oil production will remain near 2025 record,"In our January 2026 Short-Term Energy Outlook, we forecast U.S. crude oil production next year will remain near the record 13.6 million barrels per day (b/d) produced in 2025 before decreasing 2% to 13.3 million b/d in 2027. If realized, a fall in annual U.S. crude oil production will mark the first since 2021.","EIA forecasts near-term U.S. crude oil production will remain near 2025 record. In our January 2026 Short-Term Energy Outlook, we forecast U.S. crude oil production next year will remain near the record 13.6 million barrels per day (b/d) produced in 2025 before decreasing 2% to 13.3 million b/d in 2027. If realized, a fall in annual U.S. crude oil production will mark the first since 2021.",https://www.eia.gov/rss/todayinenergy.xml,https://www.eia.gov/todayinenergy/detail.php?id=67045,0.26878627486906115,0.6894685246810845,0.0417452004498543,-0.4206822498120234
2026-01-21,Air power: Tallying electricity generating potential from retired military aircraft,"When military aircraft are retired, they live out their days in the sunbelt at the U.S. Air Force's facility on Davis-Monthan Air Force Base in Arizona, otherwise known as the Boneyard.","Air power: Tallying electricity generating potential from retired military aircraft. When military aircraft are retired, they live out their days in the sunbelt at the U.S. Air Force's facility on Davis-Monthan Air Force Base in Arizona, otherwise known as the Boneyard.",https://www.eia.gov/rss/todayinenergy.xml,https://www.eia.gov/todayinenergy/detail.php?id=67044,0.8010941011781351,0.06259128671958092,0.13631461210228402,0.7385028144585541
2026-01-20,EIA expects lower gasoline prices in 2026 and 2027 as crude oil prices fall,"In our latest Short-Term Energy Outlook, we forecast retail U.S. gasoline prices will be lower the next two years than in 2025, falling 6% in 2026 and then increasing 1% in 2027. Our gasoline price forecast generally follows a similar path as global crude oil prices, but decreasing U.S. refinery capacity this year may offset some of the effects of lower crude oil prices on gasoline, especially in the West Coast region.","EIA expects lower gasoline prices in 2026 and 2027 as crude oil prices fall. In our latest Short-Term Energy Outlook, we forecast retail U.S. gasoline prices will be lower the next two years than in 2025, falling 6% in 2026 and then increasing 1% in 2027. Our gasoline price forecast generally follows a similar path as global crude oil prices, but decreasing U.S. refinery capacity this year may offset some of the effects of lower crude oil prices on gasoline, especially in the West Coast region.",https://www.eia.gov/rss/todayinenergy.xml,https://www.eia.gov/todayinenergy/detail.php?id=67024,0.624350932235904,0.1486187548111756,0.22703031295292042,0.4757321774247284
2026-01-16,Solar power generation drives electricity generation growth over the next two years,"Electricity generation by the U.S. electric power sector totaled about 4,260 billion kilowatthours (BkWh) in 2025. In our latest Short-Term Energy Outlook (STEO), we expect U.S. electricity generation will grow by 1.1% in 2026 and by 2.6% in 2027, when it reaches an annual total of 4,423 BkWh. The three main dispatchable sources of electricity generation (natural gas, coal, and nuclear) accounted for 75% of total generation in 2025, but we expect the share of generation from these sources will fall to about 72% in 2027. We expect the combined share of generation from solar power and wind power to rise from about 18% in 2025 to about 21% in 2027.","Solar power generation drives electricity generation growth over the next two years. Electricity generation by the U.S. electric power sector totaled about 4,260 billion kilowatthours (BkWh) in 2025. In our latest Short-Term Energy Outlook (STEO), we expect U.S. electricity generation will grow by 1.1% in 2026 and by 2.6% in 2027, when it reaches an annual total of 4,423 BkWh. The three main dispatchable sources of electricity generation (natural gas, coal, and nuclear) accounted for 75% of total generation in 2025, but we expect the share of generation from these sources will fall to about 72% in 2027. We expect the combined share of generation from solar power and wind power to rise from about 18% in 2025 to about 21% in 2027.",https://www.eia.gov/rss/todayinenergy.xml,https://www.eia.gov/todayinenergy/detail.php?id=67005,0.8316380717924349,0.07725318266322789,0.09110874554433723,0.754384889129207
2026-01-14,We expect Henry Hub natural gas spot prices to fall slightly in 2026 before rising in 2027,"We expect the U.S. benchmark natural gas spot price at the Henry Hub to decrease about 2% to just under $3.50 per million British thermal units (MMBtu) in 2026 before rising sharply in 2027 to just under $4.60/MMBtu, according to our January Short-Term Energy Outlook (STEO). We expect the annual average Henry Hub price in 2026 to decrease slightly as annual supply growth keeps pace with demand growth over the year. However, in 2027, we forecast demand growth will rise faster than supply growth, driven mainly by more feed gas demand from U.S. liquefied natural gas (LNG) export facilities, reducing the natural gas in storage. We forecast annual average spot prices will decrease by 2% in 2026 and then increase by 33% in 2027.","We expect Henry Hub natural gas spot prices to fall slightly in 2026 before rising in 2027. We expect the U.S. benchmark natural gas spot price at the Henry Hub to decrease about 2% to just under $3.50 per million British thermal units (MMBtu) in 2026 before rising sharply in 2027 to just under $4.60/MMBtu, according to our January Short-Term Energy Outlook (STEO). We expect the annual average Henry Hub price in 2026 to decrease slightly as annual supply growth keeps pace with demand growth over the year. However, in 2027, we forecast demand growth will rise faster than supply growth, driven mainly by more feed gas demand from U.S. liquefied natural gas (LNG) export facilities, reducing the natural gas in storage. We forecast annual average spot prices will decrease by 2% in 2026 and then increase by 33% in 2027.",https://www.eia.gov/rss/todayinenergy.xml,https://www.eia.gov/todayinenergy/detail.php?id=67004,0.311904133198442,0.16970336868379945,0.5183924981177586,0.14220076451464256
2026-01-09,"In 2025, U.S. natural gas spot prices increased from 2024's record low","In 2025, the wholesale U.S. natural gas spot price at the national benchmark Henry Hub in Louisiana averaged $3.52 per million British thermal units (MMBtu), based on data from LSEG Data. The 2025 average Henry Hub natural gas spot price increased 56% from the 2024 annual average, which-when adjusted for inflation-was the lowest on record. On a daily basis, the Henry Hub natural gas spot price ranged from $2.65/MMBtu to $9.86/MMBtu, reflecting a narrower range of daily prices compared with the previous year.","In 2025, U.S. natural gas spot prices increased from 2024's record low. In 2025, the wholesale U.S. natural gas spot price at the national benchmark Henry Hub in Louisiana averaged $3.52 per million British thermal units (MMBtu), based on data from LSEG Data. The 2025 average Henry Hub natural gas spot price increased 56% from the 2024 annual average, which-when adjusted for inflation-was the lowest on record. On a daily basis, the Henry Hub natural gas spot price ranged from $2.65/MMBtu to $9.86/MMBtu, reflecting a narrower range of daily prices compared with the previous year.",https://www.eia.gov/rss/todayinenergy.xml,https://www.eia.gov/todayinenergy/detail.php?id=66984,0.5490945073305207,0.11847163443580559,0.3324338582336737,0.43062287289471507
2026-01-05,Crude oil prices fell in 2025 amid oversupply,Crude oil prices generally declined in 2025 with supplies in the global crude oil market exceeding demand. Crude oil inventory builds in China muted some of the price decline. Events such as Israel's June 13 strikes on Iran and attacks between Russia and Ukraine targeting oil infrastructure periodically supported prices.,Crude oil prices fell in 2025 amid oversupply. Crude oil prices generally declined in 2025 with supplies in the global crude oil market exceeding demand. Crude oil inventory builds in China muted some of the price decline. Events such as Israel's June 13 strikes on Iran and attacks between Russia and Ukraine targeting oil infrastructure periodically supported prices.,https://www.eia.gov/rss/todayinenergy.xml,https://www.eia.gov/todayinenergy/detail.php?id=66944,0.5676687921788325,0.3881568516773424,0.044174356143825144,0.1795119405014901
2026-02-27,Oil Producers Negotiate Ending Windfall Tax with UK Government,"The UK Treasury is considering scrapping a windfall tax on North Sea oil and gas following persistent pushback from producers, according to a person familiar with the matter.","Oil Producers Negotiate Ending Windfall Tax with UK Government. The UK Treasury is considering scrapping a windfall tax on North Sea oil and gas following persistent pushback from producers, according to a person familiar with the matter.",https://www.rigzone.com/news/rss/rigzone_latest.aspx,https://www.rigzone.com/news/wire/oil_producers_negotiate_ending_windfall_tax_with_uk_government-27-feb-2026-183086-article/?rss=true,0.41952040411231784,0.12731122564539948,0.4531683702422827,0.29220917846691835
2026-02-26,Oil Settles Mixed as Iran Talks Continue,Crude prices eased despite cautious optimism surrounding ongoing talks in Geneva.,Oil Settles Mixed as Iran Talks Continue. Crude prices eased despite cautious optimism surrounding ongoing talks in Geneva.,https://www.rigzone.com/news/rss/rigzone_latest.aspx,https://www.rigzone.com/news/wire/oil_settles_mixed_as_iran_talks_continue-26-feb-2026-183084-article/?rss=true,0.8980300851960882,0.05195635275654204,0.05001356204736978,0.8460737324395461
2026-02-26,BP Goes Big on Shale Oil Drilling,BP Plc is aggressively expanding shale drilling.,BP Goes Big on Shale Oil Drilling. BP Plc is aggressively expanding shale drilling.,https://www.rigzone.com/news/rss/rigzone_latest.aspx,https://www.rigzone.com/news/wire/bp_goes_big_on_shale_oil_drilling-26-feb-2026-183083-article/?rss=true,0.1727275297390351,0.03897808028736318,0.7882943899736017,0.13374944945167191
