date,title,summary,combined_text,source_url,link,positive,negative,neutral,net_sentiment
2026-02-26,DOE Announces $171MM to Expand USA Geothermal Energy,The DOE said the U.S. leads the world in geothermal electricity capacity.,DOE Announces $171MM to Expand USA Geothermal Energy. The DOE said the U.S. leads the world in geothermal electricity capacity.,https://www.rigzone.com/news/rss/rigzone_latest.aspx,https://www.rigzone.com/news/doe_announces_171mm_to_expand_usa_geothermal_energy-26-feb-2026-183082-article/?rss=true,0.18771930428052733,0.5096623072810152,0.30261838843845745,-0.32194300300048795
2026-02-26,"DOE Awards Record Loans of Nearly $27B to Alabama, Georgia Utilities","Southern Co's Alabama Power and Georgia Power have secured a total of up to $26.54 billion in loans from the DOE, which would lower the cost of the utilities' grid investment.","DOE Awards Record Loans of Nearly $27B to Alabama, Georgia Utilities. Southern Co's Alabama Power and Georgia Power have secured a total of up to $26.54 billion in loans from the DOE, which would lower the cost of the utilities' grid investment.",https://www.rigzone.com/news/rss/rigzone_latest.aspx,https://www.rigzone.com/news/doe_awards_record_loans_of_nearly_27b_to_alabama_georgia_utilities-26-feb-2026-183081-article/?rss=true,0.7336634914903714,0.1124366115899686,0.15389989691966005,0.6212268799004028
2026-02-26,USA Crude Oil Stocks Jump 16MM Barrels Week on Week,"Crude oil stocks, not including the SPR, stood at 435.8 million barrels on February 20, the EIA's latest weekly petroleum status report showed.","USA Crude Oil Stocks Jump 16MM Barrels Week on Week. Crude oil stocks, not including the SPR, stood at 435.8 million barrels on February 20, the EIA's latest weekly petroleum status report showed.",https://www.rigzone.com/news/rss/rigzone_latest.aspx,https://www.rigzone.com/news/usa_crude_oil_stocks_jump_16mm_barrels_week_on_week-26-feb-2026-183078-article/?rss=true,0.15082216492156572,0.32406263953979764,0.5251151955386366,-0.17324047461823192
2026-02-26,Seatrium Doubles Annual Profit,"The Singapore-based offshore energy contractor reported around $256 million in net profit for 2025, up 106 percent from 2024.","Seatrium Doubles Annual Profit. The Singapore-based offshore energy contractor reported around $256 million in net profit for 2025, up 106 percent from 2024.",https://www.rigzone.com/news/rss/rigzone_latest.aspx,https://www.rigzone.com/news/seatrium_doubles_annual_profit-26-feb-2026-183077-article/?rss=true,0.8968971041920775,0.05455322119323349,0.048549674614689044,0.842343882998844
2026-02-26,Biggest Oil Cos Need to Find 22MM Bpd by 2040,"'The main industry players can't spend their way out of the problem', Wood Mackenzie warned.","Biggest Oil Cos Need to Find 22MM Bpd by 2040. 'The main industry players can't spend their way out of the problem', Wood Mackenzie warned.",https://www.rigzone.com/news/rss/rigzone_latest.aspx,https://www.rigzone.com/news/biggest_oil_cos_need_to_find_22mm_bpd_by_2040-26-feb-2026-183076-article/?rss=true,0.8768627020908946,0.10599408662816046,0.01714321128094498,0.7708686154627341
2026-02-26,ENGIE to Acquire UK Power Networks for $14B,"ENGIE signed an agreement to buy UK Power Networks at an equity value of around $14 billion, part of the French multinational utility's efforts to expand its predictable revenue base.","ENGIE to Acquire UK Power Networks for $14B. ENGIE signed an agreement to buy UK Power Networks at an equity value of around $14 billion, part of the French multinational utility's efforts to expand its predictable revenue base.",https://www.rigzone.com/news/rss/rigzone_latest.aspx,https://www.rigzone.com/news/engie_to_acquire_uk_power_networks_for_14b-26-feb-2026-183075-article/?rss=true,0.10918481755425571,0.6420299390059806,0.24878524343976371,-0.5328451214517249
2026-02-26,"Saudi Arabia, Iran Boost Oil Exports amid Rising Mideast Tensions","Saudi Arabia is on course to export the most crude in almost three years this month, while Iran has been rapidly filling up tankers in recent days.","Saudi Arabia, Iran Boost Oil Exports amid Rising Mideast Tensions. Saudi Arabia is on course to export the most crude in almost three years this month, while Iran has been rapidly filling up tankers in recent days.",https://www.rigzone.com/news/rss/rigzone_latest.aspx,https://www.rigzone.com/news/wire/saudi_arabia_iran_boost_oil_exports_amid_rising_mideast_tensions-26-feb-2026-183074-article/?rss=true,0.6453682952212598,0.19042670368847442,0.16420500109026576,0.4549415915327854
2026-02-25,Crude Volatile Ahead Of Iran Talks,Oil prices fluctuated as traders weighed Iran risks and supply signals.,Crude Volatile Ahead Of Iran Talks. Oil prices fluctuated as traders weighed Iran risks and supply signals.,https://www.rigzone.com/news/rss/rigzone_latest.aspx,https://www.rigzone.com/news/wire/crude_volatile_ahead_of_iran_talks-25-feb-2026-183073-article/?rss=true,0.31346015196203425,0.44004581579512264,0.2464940322428431,-0.1265856638330884
2026-02-25,North Sea Oil Signals Weakness,The North Sea crude market is flashing signs of weakness.,North Sea Oil Signals Weakness. The North Sea crude market is flashing signs of weakness.,https://www.rigzone.com/news/rss/rigzone_latest.aspx,https://www.rigzone.com/news/wire/north_sea_oil_signals_weakness-25-feb-2026-183072-article/?rss=true,0.18924173887670115,0.3524895186293187,0.45826874249398014,-0.16324777975261756
2026-02-25,Technip Energies Adds to Spate of Deals with $1B+ Contract,Technip Energies announced that it has been awarded a 'major' contract by QatarEnergy.,Technip Energies Adds to Spate of Deals with $1B+ Contract. Technip Energies announced that it has been awarded a 'major' contract by QatarEnergy.,https://www.rigzone.com/news/rss/rigzone_latest.aspx,https://www.rigzone.com/news/technip_energies_adds_to_spate_of_deals_with_1b_contract-25-feb-2026-183070-article/?rss=true,0.4629789650633652,0.5122192165364167,0.024801818400218112,-0.049240251473051444
2026-02-25,EOG Posts Lower Q4 Profit,"EOG reported $701 million in net profit and $1.22 billion in adjusted net profit for the fourth quarter (Q4) of 2025, both down sequentially and year-on-year on lower oil and gas price realizations in the U.S.","EOG Posts Lower Q4 Profit. EOG reported $701 million in net profit and $1.22 billion in adjusted net profit for the fourth quarter (Q4) of 2025, both down sequentially and year-on-year on lower oil and gas price realizations in the U.S.",https://www.rigzone.com/news/rss/rigzone_latest.aspx,https://www.rigzone.com/news/eog_posts_lower_q4_profit-25-feb-2026-183068-article/?rss=true,0.8006823523025552,0.0524980860249703,0.14681956167247445,0.7481842662775849
2026-02-25,EIA Sees USA Energy Demand Under 2025 Levels for Next 2 Years,The U.S. Energy Information Administration projected that U.S. total energy consumption will remain below 2025 levels in both 2026 and 2027.,EIA Sees USA Energy Demand Under 2025 Levels for Next 2 Years. The U.S. Energy Information Administration projected that U.S. total energy consumption will remain below 2025 levels in both 2026 and 2027.,https://www.rigzone.com/news/rss/rigzone_latest.aspx,https://www.rigzone.com/news/eia_sees_usa_energy_demand_under_2025_levels_for_next_2_years-25-feb-2026-183067-article/?rss=true,0.5004688904402387,0.08924217210615444,0.4102889374536069,0.41122671833408425
2026-02-25,Cropped 25 February 2026: Food inflation strikes | El Niño looms | Biodiversity talks stagnate,"We handpick and explain the most important stories at the intersection of climate, land, food... 
 The post  Cropped 25 February 2026: Food inflation strikes | El Niño looms | Biodiversity talks stagnate  appeared first on  Carbon Brief .","Cropped 25 February 2026: Food inflation strikes | El Niño looms | Biodiversity talks stagnate.  We handpick and explain the most important stories at the intersection of climate, land, food... 
 The post  Cropped 25 February 2026: Food inflation strikes | El Niño looms | Biodiversity talks stagnate  appeared first on  Carbon Brief .",https://www.carbonbrief.org/feed,https://www.carbonbrief.org/cropped-25-february-2026-food-inflation-strikes-el-nino-looms-biodiversity-talks-stagnate/,0.8301022714758565,0.1478991276533527,0.021998600870790835,0.6822031438225038
2026-02-24,Dangerous heat for Tour de France riders only a ‘question of time’,"Rising temperatures across France since the mid-1970s are putting Tour de France competitors at “high... 
 The post  Dangerous heat for Tour de France riders only a ‘question of time’  appeared first on  Carbon Brief .","Dangerous heat for Tour de France riders only a ‘question of time’.  Rising temperatures across France since the mid-1970s are putting Tour de France competitors at “high... 
 The post  Dangerous heat for Tour de France riders only a ‘question of time’  appeared first on  Carbon Brief .",https://www.carbonbrief.org/feed,https://www.carbonbrief.org/dangerous-heat-for-tour-de-france-riders-only-a-question-of-time/,0.33875583315890634,0.42250162638620925,0.2387425404548844,-0.08374579322730291
2026-02-20,DeBriefed 20 February 2026: EU’s ‘3C’ warning | Endangerment repeal’s impact on US emissions | ‘Tree invasion’ fuelled South America’s fires,"Welcome to Carbon Brief’s DeBriefed. An essential guide to the week&#8217;s key developments relating to climate... 
 The post  DeBriefed 20 February 2026: EU’s ‘3C’ warning | Endangerment repeal’s impact on US emissions | ‘Tree invasion’ fuelled South America’s fires  appeared first on  Carbon Brief .","DeBriefed 20 February 2026: EU’s ‘3C’ warning | Endangerment repeal’s impact on US emissions | ‘Tree invasion’ fuelled South America’s fires.  Welcome to Carbon Brief’s DeBriefed. An essential guide to the week&#8217;s key developments relating to climate... 
 The post  DeBriefed 20 February 2026: EU’s ‘3C’ warning | Endangerment repeal’s impact on US emissions | ‘Tree invasion’ fuelled South America’s fires  appeared first on  Carbon Brief .",https://www.carbonbrief.org/feed,https://www.carbonbrief.org/debriefed-20-february-2026-eus-3c-warning-endangerment-repeals-impact-on-us-emissions-tree-invasion-fuelled-south-americas-fires/,0.5871761691505378,0.06309569234688997,0.34972813850257223,0.5240804768036479
2026-02-20,Q&A: How Trump is threatening climate science in Earth’s polar regions,"Since Donald Trump returned to the White House last year, his administration in the US... 
 The post  Q&#038;A: How Trump is threatening climate science in Earth’s polar regions  appeared first on  Carbon Brief .","Q&A: How Trump is threatening climate science in Earth’s polar regions.  Since Donald Trump returned to the White House last year, his administration in the US... 
 The post  Q&#038;A: How Trump is threatening climate science in Earth’s polar regions  appeared first on  Carbon Brief .",https://www.carbonbrief.org/feed,https://www.carbonbrief.org/qa-how-trump-is-threatening-climate-science-in-earths-polar-regions/,0.710008640060121,0.15641525846744322,0.1335761014724358,0.5535933815926778
2026-02-20,Limiting warming to 2C is ‘crucial’ to protect pristine Antarctic Peninsula,"Keeping global warming to less than 2C above pre-industrial temperatures is “crucial” for limiting damage... 
 The post  Limiting warming to 2C is ‘crucial’ to protect pristine Antarctic Peninsula  appeared first on  Carbon Brief .","Limiting warming to 2C is ‘crucial’ to protect pristine Antarctic Peninsula.  Keeping global warming to less than 2C above pre-industrial temperatures is “crucial” for limiting damage... 
 The post  Limiting warming to 2C is ‘crucial’ to protect pristine Antarctic Peninsula  appeared first on  Carbon Brief .",https://www.carbonbrief.org/feed,https://www.carbonbrief.org/limiting-warming-to-2c-is-crucial-to-protect-pristine-antarctic-peninsula/,0.7229011829044466,0.14696037520756658,0.13013844188798682,0.57594080769688
2026-02-19,China Briefing 19 February 2026: CO2 emissions ‘flat or falling’ | First tariff lifted | Ma Jun on carbon data,"Welcome to Carbon Brief’s China Briefing. China Briefing handpicks and explains the most important climate... 
 The post  China Briefing 19 February 2026: CO2 emissions ‘flat or falling’ | First tariff lifted | Ma Jun on carbon data  appeared first on  Carbon Brief .","China Briefing 19 February 2026: CO2 emissions ‘flat or falling’ | First tariff lifted | Ma Jun on carbon data.  Welcome to Carbon Brief’s China Briefing. China Briefing handpicks and explains the most important climate... 
 The post  China Briefing 19 February 2026: CO2 emissions ‘flat or falling’ | First tariff lifted | Ma Jun on carbon data  appeared first on  Carbon Brief .",https://www.carbonbrief.org/feed,https://www.carbonbrief.org/china-briefing-19-february-2026-co2-emissions-flat-or-falling-first-tariff-lifted-ma-jun-on-carbon-data/,0.10045751690235481,0.29159214442912545,0.6079503386685197,-0.19113462752677063
2026-02-19,Ma Jun: ‘No business interest’ in Chinese coal power due to cheaper renewables,"Open and transparent data can accelerate the decarbonisation of China’s industries and boost public interest... 
 The post  Ma Jun: ‘No business interest’ in Chinese coal power due to cheaper renewables   appeared first on  Carbon Brief .","Ma Jun: ‘No business interest’ in Chinese coal power due to cheaper renewables.  Open and transparent data can accelerate the decarbonisation of China’s industries and boost public interest... 
 The post  Ma Jun: ‘No business interest’ in Chinese coal power due to cheaper renewables   appeared first on  Carbon Brief .",https://www.carbonbrief.org/feed,https://www.carbonbrief.org/ma-jun-no-business-interest-in-chinese-coal-power-due-to-cheaper-renewables/,0.11558139390866584,0.82171210311814,0.06270650297319413,-0.7061307092094742
2026-02-17,Chris Stark: The economics of clean energy ‘just get better and better’,"The economics of clean energy “just get better and better”, leaving opponents of the transition... 
 The post  Chris Stark: The economics of clean energy ‘just get better and better’  appeared first on  Carbon Brief .","Chris Stark: The economics of clean energy ‘just get better and better’.  The economics of clean energy “just get better and better”, leaving opponents of the transition... 
 The post  Chris Stark: The economics of clean energy ‘just get better and better’  appeared first on  Carbon Brief .",https://www.carbonbrief.org/feed,https://www.carbonbrief.org/chris-stark-the-economics-of-clean-energy-just-get-better-and-better/,0.8029775022585474,0.16385681988020698,0.03316567786124566,0.6391206823783404
2026-02-17,Guest post: The challenges in projecting future global sea levels,"It is well understood that human-caused climate change is causing sea levels to rise around... 
 The post  Guest post: The challenges in projecting future global sea levels  appeared first on  Carbon Brief .","Guest post: The challenges in projecting future global sea levels.  It is well understood that human-caused climate change is causing sea levels to rise around... 
 The post  Guest post: The challenges in projecting future global sea levels  appeared first on  Carbon Brief .",https://www.carbonbrief.org/feed,https://www.carbonbrief.org/guest-post-the-challenges-in-projecting-future-global-sea-levels/,0.3460113003221291,0.03788240431415789,0.616106295363713,0.3081288960079712
2026-02-16,Q&A: What does Trump’s repeal of US ‘endangerment finding’ mean for climate action?,"On 12 February, US president Donald Trump revoked the &#8220;endangerment finding&#8221;, the bedrock of federal... 
 The post  Q&amp;A: What does Trump’s repeal of US ‘endangerment finding’ mean for climate action?  appeared first on  Carbon Brief .","Q&A: What does Trump’s repeal of US ‘endangerment finding’ mean for climate action?.  On 12 February, US president Donald Trump revoked the &#8220;endangerment finding&#8221;, the bedrock of federal... 
 The post  Q&amp;A: What does Trump’s repeal of US ‘endangerment finding’ mean for climate action?  appeared first on  Carbon Brief .",https://www.carbonbrief.org/feed,https://www.carbonbrief.org/qa-what-does-trumps-repeal-of-us-endangerment-finding-mean-for-climate-action/,0.8024076793632324,0.18710993842213045,0.010482382214637126,0.615297740941102
2026-02-26,Burger King rolls out AI headsets that track employee 'friendliness',The fast-food chain is testing OpenAI-powered headsets that monitor staff interactions with customers.,Burger King rolls out AI headsets that track employee 'friendliness'. The fast-food chain is testing OpenAI-powered headsets that monitor staff interactions with customers.,https://feeds.bbci.co.uk/news/business/rss.xml,https://www.bbc.com/news/articles/cgk2zygg0k3o?at_medium=RSS&at_campaign=rss,0.16852276165430302,0.4040900083008438,0.4273872300448532,-0.23556724664654077
2026-02-25,Household energy bills to fall in April after charges shake-up,"Changes announced in the Budget mean all energy bills will see some kind of reduction, but it will vary.","Household energy bills to fall in April after charges shake-up. Changes announced in the Budget mean all energy bills will see some kind of reduction, but it will vary.",https://feeds.bbci.co.uk/news/business/rss.xml,https://www.bbc.com/news/articles/cx2lpl9lxw2o?at_medium=RSS&at_campaign=rss,0.1553700147747069,0.6424273956035415,0.20220258962175164,-0.48705738082883454
2026-02-16,Trump eyes Venezuela visit – but obstacles to his oil plan remain,The US president wants American energy firms to start extracting the crude but they are reluctant.,Trump eyes Venezuela visit – but obstacles to his oil plan remain. The US president wants American energy firms to start extracting the crude but they are reluctant.,https://feeds.bbci.co.uk/news/business/rss.xml,https://www.bbc.com/news/articles/c4gjx1j1nkjo?at_medium=RSS&at_campaign=rss,0.7126675434455902,0.036891034895335136,0.2504414216590746,0.6757765085502551
2026-02-26,'Is this all good debt or bad debt?',Karen has not only left the family in emotional turmoil but also serious debt,'Is this all good debt or bad debt?'. Karen has not only left the family in emotional turmoil but also serious debt,https://feeds.bbci.co.uk/news/business/rss.xml,https://www.bbc.com/news/videos/c05v93l1vmmo?at_medium=RSS&at_campaign=rss,0.4802259024789851,0.2857736666226454,0.23400043089836947,0.1944522358563397
2025-11-25,Has Britain's budget watchdog become too all-powerful?,"Ahead of this week's Budget, some have accused the Office for Budget Responsibility of being a ""straitjacket on growth""","Has Britain's budget watchdog become too all-powerful?. Ahead of this week's Budget, some have accused the Office for Budget Responsibility of being a ""straitjacket on growth""",https://feeds.bbci.co.uk/news/business/rss.xml,https://www.bbc.com/news/articles/clyx9n5p7v7o?at_medium=RSS&at_campaign=rss,0.31204530315204726,0.6001944082999457,0.08776028854800699,-0.2881491051478985
2026-02-26,'Is this all good debt or bad debt?',Karen has not only left the family in emotional turmoil but also serious debt,'Is this all good debt or bad debt?'. Karen has not only left the family in emotional turmoil but also serious debt,https://feeds.bbci.co.uk/news/business/rss.xml,https://www.bbc.com/news/videos/c05v93l1vmmo?at_medium=RSS&at_campaign=rss,0.43851035216070955,0.11892249978666834,0.4425671480526221,0.3195878523740412
2026-02-25,Martin Lewis on what the new energy price cap means,"Typical household energy bills will fall by 7% in April, regulator Ofgem has announced, following a shake-up in charges by the government.","Martin Lewis on what the new energy price cap means. Typical household energy bills will fall by 7% in April, regulator Ofgem has announced, following a shake-up in charges by the government.",https://feeds.bbci.co.uk/news/business/rss.xml,https://www.bbc.com/news/videos/c33jr4g8gvyo?at_medium=RSS&at_campaign=rss,0.5314368710235667,0.34201878566991234,0.12654434330652092,0.1894180853536544
2026-02-26,Democrats urge dropping plan to double gas exports as US energy prices soar,"Families are ‘struggling with cost of heating their homes’, letter says as Trump repeatedly pledges to slash utility bills  As energy prices for US households soar nationwide, Democratic and progressive lawmakers are calling on the energy department to end its plan to double exports of liquefied natural gas (LNG).  “The Trump administration’s LNG export policies are not putting America first: they have jacked up utility prices for families, leaving many Americans struggling with the cost of heating their homes this winter,” reads a letter to the energy secretary, Chris Wright, sent the Democratic senator Elizabeth Warren of Massachusetts, Independent senator Bernie Sanders of Vermont and seven others.   Continue reading...","Democrats urge dropping plan to double gas exports as US energy prices soar.  Families are ‘struggling with cost of heating their homes’, letter says as Trump repeatedly pledges to slash utility bills  As energy prices for US households soar nationwide, Democratic and progressive lawmakers are calling on the energy department to end its plan to double exports of liquefied natural gas (LNG).  “The Trump administration’s LNG export policies are not putting America first: they have jacked up utility prices for families, leaving many Americans struggling with the cost of heating their homes this winter,” reads a letter to the energy secretary, Chris Wright, sent the Democratic senator Elizabeth Warren of Massachusetts, Independent senator Bernie Sanders of Vermont and seven others.   Continue reading...",https://www.theguardian.com/environment/energy/rss,https://www.theguardian.com/us-news/2026/feb/26/democrats-gas-exports-energy-prices,0.26092085071175675,0.23038301139395168,0.5086961378942916,0.03053783931780507
2026-02-26,Drax to stop burning controversial Canadian wood within next year,"Yorkshire plant has been criticised for taking material from some of British Columbia’s most environmentally important forests  The owner of Drax power plant has started reducing the amount of Canadian wood pellets it burns, and will stop burning trees from British Columbia entirely within the next year.  The FTSE 250 company Drax Group said its Canadian wood pellet plants, which once supplied millions of tonnes of biomass to be burnt in its North Yorkshire power plant, had cost the company almost £200m in financial impairments last year.   Continue reading...","Drax to stop burning controversial Canadian wood within next year.  Yorkshire plant has been criticised for taking material from some of British Columbia’s most environmentally important forests  The owner of Drax power plant has started reducing the amount of Canadian wood pellets it burns, and will stop burning trees from British Columbia entirely within the next year.  The FTSE 250 company Drax Group said its Canadian wood pellet plants, which once supplied millions of tonnes of biomass to be burnt in its North Yorkshire power plant, had cost the company almost £200m in financial impairments last year.   Continue reading...",https://www.theguardian.com/environment/energy/rss,https://www.theguardian.com/environment/2026/feb/26/drax-power-plant-to-stop-burning-controversial-canadian-wood-within-next-year,0.8961194853287158,0.06750966710116095,0.03637084757012328,0.8286098182275549
2026-02-26,Calls to move England’s home insulation scheme into council workers’ hands,"Thinktank proposes councils stop using private contractors in attempt to improve quality and spending  Councils should train up their own workers to install insulation in England’s draughty houses, and offer home upgrades street by street, beginning in the most deprived areas, according to proposals for cutting energy bills.  Setting up “home improvement corporations” would allow greater control by councils over low-carbon retrofits for housing, and would be a more efficient way of spending limited public funds for insulation,  according to the Common Wealth thinktank , sets out the proposals in a report this week.   Continue reading...","Calls to move England’s home insulation scheme into council workers’ hands.  Thinktank proposes councils stop using private contractors in attempt to improve quality and spending  Councils should train up their own workers to install insulation in England’s draughty houses, and offer home upgrades street by street, beginning in the most deprived areas, according to proposals for cutting energy bills.  Setting up “home improvement corporations” would allow greater control by councils over low-carbon retrofits for housing, and would be a more efficient way of spending limited public funds for insulation,  according to the Common Wealth thinktank , sets out the proposals in a report this week.   Continue reading...",https://www.theguardian.com/environment/energy/rss,https://www.theguardian.com/environment/2026/feb/26/calls-to-move-england-home-insulation-scheme-into-council-workers-hands,0.45048006713160327,0.28441824142018174,0.265101691448215,0.16606182571142153
